,cleaned_text
616,think itd fun fun bright side dont fight park
451,dont know im nj worst purpose laughter
2246,king say doesnt matter fact come w psycho far affront
1061,wow need start sif im prob gonna die
815,abysmal ignorance frivolity levity italian priests stupefy roland bainton luther reformationday
1659,fuck shy im try thighs
1034,id let jiho step throat hed probs afraid hed hurt
2882,many gloomy days
3486,oh yes males colourful females dull blend environment
1532,let panic beat nyg whos atop division come home cleveland like youre division win
2301,need new outlet rage
2164,though u want offend americans
1538,awful service camden store yesterday assistants think important put clothe hangers serve
2575,husband find rabid hockey fan like wait line window stickers sj nhlahl hockey
1485,thtest match would odi national color nightmare hitter
3311,end meet mother dreadful
2856,hate gloomy outside always get depress mood
2579,ive want salty fry mcdonalds since yesterday im burn finger eat bc shit
1468,disable access pontefract monkhill terrible
2287,gotta use dark skin emoji offend
2088,flat party instantly get bollocked fume
1212,old lady cray cray scar bellaissocute awe empire
771,yall dont feel bad rejoice itnis always coltsnation even th string dbs play
3490,example catch gloom would yield oddish candy catch vileplume would yield
3181,let know blue
570,every time new anthony weiner revelation break bill clinton say prayer thank textingdming didnt exist heyday
1030,pakistan stop cross border terrorism really need solution kashmirissue sir india act
1922,getsmartwitharq smart way start invest whiteicenetwork smart source start skilled manpower recruitment ur firm
1028,thank nightmare
699,grumble sit atop sushi bar stool cross arm defiantly playful gesture though give anyone gt
649,method thin assault corridor thine liveliness chd
542,know youre proactively playful want press boob face tatenashi im say though
578,go follow beautiful snowgang princess fitness bodyposi haircut whitegirlwednesday
3410,use pawn red womans game try fret act nothing amiss royal
1934,mattmilne thank let us know please hesitate contact us future assistance need thank
3361,solemn thing small scandal kingdom see god children starve seat father table aw tozer
2305,huff puff
2395,love people make plan without actually include process
1991,be dont tell true blood hoopjunkie switch fc team juz destroy team juz dont insult
1490,nadia bully ill expose
1563,first take room wanna beat
380,youre prof suggest william jam may unlikely dialogue partner play happy video wearecst
849,break hive first time since college finals anxiety suck
352,minutes yoga breakfast routine change day preparation sunriseyoga bodyawareness health yoga stretch
1553,say teufel reassign within organization next year wish sooner mets thirdbasecoach lgm
2087,angry already
1418,isnt exactly take long afraid clintonmafia congress
1017,maybe parentsthat would understand fear indifference mom dad
26,make world joyful place thenicebot
2484,know softballs could sting bad jimmy fallon lot heat ampldquosoftballamprdquo donald trump interview
1292,king never speak leave crush freespeech publish worldnntrump horror scifi ccot p
2399,sense take wrath innocent people think police shoot innocent man makeamericasafeagain
2792,snap hialeshia
1253,study skills terrible
1808,good morningnn leadership healthcareit socialmedia connector ceo writer ai eq security bigdata growthhacking tech
619,mostly animate audience id betgreen sceen folkthe ones dont need air
1178,america find gratitude amidst sadness frustration race fear anger racism remain hopeful im earth fixer
1128,canada drive force democracy freedom right instead help dictator misogyny sharia islam polygamy
2612,one month til someones bday think time flaunt get something pretty awesome revenge
2103,fuck coupon goal
1562,watch tna first time long time hell happen hardyboys impactonpop wwe terrible
3433,refuge recovery boston wed pm heal support addiction recovery buddhism meditation sober cambma meet harvardsq
1939,cant start good day without cup tea nn tea day goodday
2534,unleash gods wrath cain
396,omg youve get watch new series uswow best tv show ive see long timen tear moretears
994,horrific situations get worse trump elect vote hillary
1935,study find awe amp wonder something greater self lead creative boost expansive think write thoreau
2832,try fail dont try still fail confuse lose
2243,inpouring letter die subsist check quaint virtuoso ways toward fine huff l
1340,nwe cant forget pastbut apprehend punish culprits pastare go allow present slip away
1478,anyone spoil fuck show haunt afterlife help god
298,watch amaze lively broadcast lively musically
2531,oh dear watch woman pout well
1756,best moto gp loose talented rider
2363,compare akshay sir zandu balm insult akshay sir
1111,nawazsharif confess pakistan support terror unganburhanwani
1607,bully make u feel like bigman cos make u twat
2744,focus dont let others love define youre happy dont let make bitter get hurt
2290,incentivise people roam internet morally offend didnt enough already
774,remember glee take leave cover two girls werent even friends
2356,inner conflict happen odds honor value priorities innerconflict conflict value
1062,body say fuck bitch aint sleepingn sleep cantsleep drain
2434,good thing fbi didnt offend
2393,damn offense mix bag unpredictable lethal weapons im worry defense coordinators chargers boltup recharge
2519,become boil hot slowly melt heart freeze
3125,weeks course kitchen sink throw still pull knives fork ears
342,give playful wink take goggle head swing around finger would never
38,today reach subscribers yt happy goodday thankful
75,im watch joyful noise time cuz love movie
3611,second artist announcement look good bluesfest blue music byronbay
1132,girls hairy arm scare
2806,ughhh love clean house incense light aromatherapy
1199,appropriate first secretary permanent mission task demolition terror state pakistan like renunciation lie bite
1541,problem yes something
2369,even give pizzas serious fail hungry hangry
225,let playful gasp slowly wrap arm around neck kiss back
2669,alarm clock ring morning n flatmate knock door ask set anything fire im burn alive
914,posh frighten im still scar
2892,fuck sad person love doesnt try fight happiness youd anything
2224,meanwhile white cop keep kill black people theres less outrage strange society
3087,first coat pair sunglasses next itll limb lose
3465,already plot next step get cut minivan tomorrows dropoff line preschoolpolitics momthings
3294,last week cn im gonna sad leave also first plan break since go animation
2916,call im lay bed mop like intend next months
1216,haters low self worth self righteous delusions cower think change change inevitable
70,days gopackgo days gogipego im excite
3265,doesnt anyone else literally pull office cause someone complain spit sink yesterday
2778,sometimes best motivations come prove wrong energy motivationalquotes
2438,im surprise would fume
553,boss like stand office amp smile like shark maliciously gleeful ask secret tell
2524,move clip youtube tonight vigil hold tulsa metropolitan baptist church terencecruther justice sadness
2217,never watch grey anatomy ever ever ever ever ever shonda rim take away another og character fume
901,omg horrific something need do
3077,blame manager watch players play abysmal team dreadful jose cant save us noone mufc
2629,best revenge massive success frank sinatra
2311,find initiative isnt even thing revenge
720,light day per heyday popularization backfire cinematography xucqb
1104,jesus weep another rns rusty quote price sensitive news price sensitive news etc etc ramp shock
2777,like hello first bear must always laugh joke
2067,something need do people hog machine nobody use machine one time notfair whypay
3009,id rather die alone end somebody cant sober
2569,live order complete amaze life journey successfully bitter
1294,coincidence turn tv etcamp listen amp watch objective captureyourmind fear amp depression findgodnow
879,shamefull unequal dangerous worry world live nowadays terrify charlotte terrorism shitworldforourkids
2571,straight people canoodle quad im
2645,gonna kind community raid wrath machine drop
776,logically speak cant worst ive ever felt even pass still joyous occasion
1999,get angry people dont know dont stop sign francis foster road
1270,bitch worry worry
2165,unarm black kill white cop many die every month chicago wheres
679,find way top
2850,depress shit ever
1313,americans think media nothing government propaganda bs lie control bs riggedsystem garbage oreillyfactor
2689,one main things im w c fill void empty bitter heart make everything want grow
2649,apparently hes suppose scottish accent im
2448,snapchat back constant battle see get ugliest snap one another snap survival
506,twitter font endless hilarity
148,man know juggle didnt ball itn funny pun punny lol
1573,check scotland gamer youtuber vlogger designer animator artist ty follow wake horror horrorfilm
1,oh dear even absolute hilarity dont think laugh much long time
1590,hate bakewell tart anything taste almond essence horrid gbbo
279,watch amaze lively broadcast musically
525,always ready
1780,terror love
3529,nnhearing noise akame open eye sit face juvia didnt expect see someone around staid
3018,september still battle situation say handle march year unacceptable
2127,ill honest hope annoy southern bint look pout go week selasi ftw
3352,kudos tc bench bruce isnt help team rid pine game win discussion mets
1045,indian seem afraid war n like india war war war cry war pakistanmustpay
1070,struggle real whoa worry younger generation
463,think pre prepped debate answer potential hilarity
1774,good greatdont breathe horror film month fav horror film year far
904,mm nothing like good old fashion panic induce cry live room floor
3081,voice miley alicia year longer contestants sad
2795,doesnt offend weird
3356,episode today whilst edit power outage rebuildtomorrow podcast lose edit fail tomorrow
1109,pump interview
1583,flavour danish far better danish pastry daunt make
3379,im onto know secretly pine masculine order objective morality discipline transcendent pursuits
5,today reach subscribers yt goodday thankful
3003,depress suicidal person see someone sing depress life yet fun relatable encourage
122,something cool breezy fall days
3180,everything far away time short rest weary
1378,tip wifi terrible past week slow drop continuously nw calgary
1131,reverse half way woods collect dog n ive never even reverse park life
1314,vals soggy bottom face haunt stay strong vdog
784,wonder gleeful dumb af see world rise tint glass
1831,im curious know much money original air bud make justify continuation awful sequels spinoffs
316,watch amaze lively broadcast musically
2259,fake people irritate
1995,actually fume nothing wear saturday
1304,people deepest passions often scare much admit even
2568,let general tweet offend definitely shouldnt twitter
1859,weeks massacre theatre pert first one think require subtitle
438,worse expect hilarious one even remember
2736,recommend read prisoners hate aaron beck
2893,charlotteprotest u wait facts video u hate ask question later sad protest policeshootings suggestions
3269,problem time take mean go date already sadly
3480,let get drink tell things afraid say sober
1832,youve get tremendous range
2779,tonights dragrace allstars episode give life yaassss queen teamalaska teamkatya bwahaha
3513,add paul walker xbox spend time dashboard dark humor funny
3591,happiness always choose see theres point dwell dark ignore light star
2923,sometimes worst place headnn quote worstenemy thinktoomuch
1218,nwe express deep concern suspension n please reactivate never violate troles
2728,klitschko fury day box
243,felt bite shit get high blood sugar remember first one week incredible happy
2348,yuuuhh plus clin ep prevmed ugghhh hahaha bitter
1885,would advise everyone wait watch actually dont wait dont even watch awful
1076,mac update kind apprehensive
1397,feel strongly need work together right dreadful wrong
2401,indignant want world know obama nothing putin want aleppo syria
622,im worry someday ill yell kid theyll confuse im serious nnim damn playful
1956,jeans fake pocket
2322,smh remove ideologically bankrupt opportunistic establishment theyre burn bridge social contract
3331,mhchat childhood experience inform adult relationships associative memories question ability process
3335,hopefully next time play l team players score take shirt ampjumps away end purely wind joyless cunts
3076,conflict report mama ritamarley healthmannn wake today feel like mi ole selfrejoicenow dis sadness
100,find marmite australia happy
3156,contact shock experience clear sky holiday book guy customerservicefail dreadful
1833,ok ok know last tweet terrible
1026,watch paranormal activity ghost dimension im sure feel yet horror
2458,revenge feel good revenge feel worse
1441,obama admin reject texas plan refugees vet terrorism texas pull feed refugee resettlement program aid
3253,think sink teeth something thats mean b sooked
1159,prepurchased ticket send soon come saturday even show ticket show panic hoys
2737,thats joke know incense
235,another happy customer secreteyes
502,im laundry watch show bunch strangers birthday
1605,go get new horror movie tattoo tonight artist flake rd time amp say do tattoo
2618,gotta wonder caller max listen show first place incense
953,fuck even thats fuck horrific
1627,king never speak leave crush freespeech publish worldnn trump scifi ccot p
1969,omg kiss w
1342,val type woman would dread bring donation bake sale gbbo
2107,towhy cant brothers protect one another ones serious make furious dont mislead think fred mayfield
2354,oh good god quentin letts one comedy turn angry bbctw
2502,jealous cry baby gladsheisgone crybaby
461,assume people pick joviality coz lol lot work maybe need get heavy hand emoticons ha
2536,dis dat nigga fume right
696,tweet picture four fictional character describe one animate character
1457,maybe thats ask study hard get job like way wouldnt dreadful
709,thats compatibility key lower hedonic volatility
1825,ramos grind shake headers
3479,hermione sort thank slide plate away frown ron continue
2877,somewhere hope despair day meetingmyabuserincourt ndvsurvivor
511,babe remember im always u need little cheer talk ily lot
587,remember heyday ladies range age id say mids early
609,hunter way content joyous simple domestic bliss cannot wait word truly
3128,mourn creativity lose
3478,tear r inappropriate day holy lord grieve joy lord strength nehemiah niv joy
1494,shock awe place toddler manage get dinner
1690,start get chris sutton tv campaign spread work pundit noclue
2342,time remove cb team somehow screw rip bandaid itll sting bite everyone get
1683,finally start homefronttherevolution story gameplay wasteofmoney
3278,dont get discourage maybe prayers divine intervention help would help
1943,awe thank couldnt without help support amaze encouragement
2766,meet olympic house golds neverquit believe dreambig teamtto goinggold
373,watch amaze lively broadcast lively musically
2723,orange one poisonous bitter shouldnt judge blue one look taste delicious
637,despite absolute delight children would feel kitten home misery husband would feel
302,watch amaze lively broadcast lively musically
2489,yep lol
3473,good one reporter quit
3420,tell chiropractor im good time long time question habit yet unnerve doctor
99,look back recent tweet see one right great perfect hilarious speechless deal
1166,round panic pcola
1249,cant get better look bc im shy make eye contact
2119,hell hath fury like women scorn affair parent
496,heavy days give much need levity thank bro
2464,hell hot boil isi ewu
2108,wake say try change nappy
3537,labor love cheap inexpensive time spend earn lackadaisical dreamer
2782,sound like good game plan offense
1139,much trouble dont think rev see funny side project
989,doctor give flower extract relieve anxiety reduce panic attack
1137,quite simply worst airline worstairline ive ever use shock appauling dire dismal beyondajoke useless
1582,pussy weak hear stfu bitch get threaten pregnant
3604,great tournament chair award serious
2797,follow snapchat carlabtst snapchat
3367,great programme tonight upset extremeworld
2842,go home depress
1592,alarm preset life wakemeup
1439,one step long work visa process relief onto next step expat restless
785,sparkle still terribledebatequestions
2210,sex offense happen across race culture creeds amp castrate
62,always indeed wonderful experience fly guy today bestinbusiness delight happyme
268,optimism lead success bill kerr success goals
355,every single problem ever face solve nice blend patience optimism
344,live simply dream big grateful give love laugh lot unknown quote inspiration
2368,sister throw legitimate temper tantrums get attention
521,least walk past break laughter
2113,test angry
2452,inner conflict happen odds honor value priorities anger innerconflict conflict value
583,currently listen amp podcast guy please move yvr missyou
3298,lord make instrument peace theres hate let sow love theres injury pardon theres despair hope
2007,people infuriate
1097,librarians scare
1927,usa embarrass watch last time guy game joke
1067,india sponsor terrorism balochistan kulbhushanyadav indian spy agent arrest balochistan pakistani force
1372,jk im loner really shy
103,love see happy women glow something real
3097,one step forward two step backward link rogerfederershop work lose hope roger federer new website sadness
3322,use fear state view get facts make serious statement
965,lysol get stick spray position slowly suffocate trash smell like febreeze factory panic
2610,dude new madden haha
668,assure eventual destruction would interest public cheerfully accept sherlock holmes
2177,cant believe ive get days leave backtoreality rag
955,people country million go ruin whole country people fear
3603,picoftheday howwhy really n funny picoftheday lol random laugh chair despair funnypics virgin cafe
2333,ive leave dad deal work do soon felt wrath slipper
1510,dont know patronus dont think tell shock
1809,unbelievable mcdavid matthews lundqvist nothing shake head wch
3429,look forward hop lot stetsontilting rueful look whiskey glass
1983,come glasgow night work fuck gutted wait appearance age rag
20,love parody account well do vote trump lol hilarious
164,guitar shop owners everywhere rejoice
2366,rage rage ep come soon ill keep post youtube youtubegaming rage
2061,whole clown rage scar shitless im gonna go cry room
1589,never end moment dire small spark hope relight new fire
3595,nice see balotelli back best good player lose way bite
1031,hospital elouises water go panic labour littlesister superexcited
942,go first get book sign amp barely take picture cuz im shake
2357,epipen public outrage occur expand pap patient assistance progrm couponsrebates mylan epipen
2653,solution assumptions media article every venue cause animosity conversation
1470,maybe break smaller bits space doesnt seem daunt
3067,exact minus beer sadly
3606,hmu need players lans next year dm need serious players im org
2406,doll vile creature touchline every game tantrums amp shout ref would love see
40,fun funniest person funsville much hilarity usual thank
2104,natalie one top three favorites toofaced bitter
228,omg im outside make beat garageband little bird decide chirp along
536,see ill hover block button today much glee
2436,tyson fury beat man top years danny garcia bradley pacquaio frampton
1678,okay dead id come back lovingly haunt sweet asses
2613,strong independant practical stop live world fantasy snap faster u get use reality better
2724,get madden k ps add trackdawgt let run
3217,theres something note fact mask manufacturer produce smile frown
3346,thats even though way light finish properly without cause serious mischief
1684,jeans fake pocket horrible
53,food get deliver cheer happy
3522,gloomy weather put best mood
2952,get diagnose severeextreme depression didnt know difference two lol
2252,apparently hes suppose scottish accent im offend
459,followback quotesoup happy everything good see good side everything optimism
1555,busy cod whole network manager unityd base steamworks network gamedev indiedev amdeadtime horror game
3364,fellaini play ahead guyjust let sink
996,husband lose book apartment didnt exist didnt care nightmare airbnbnightmare
1316,mine good rn gonna horrid next week
2974,provide customers wequipment doesnt deliver speed internet service charge unhappy scam
3423,people already talk halloween nyoull get dark music go itngothic bloody halloweenhorrornights
2949,lose xt nova around hole sadness
3132,u know u much ur mind u find clean stave kitchen almost pensive
3187,someone need tell candice shell stick shitty pout wind change gbbo
658,wish unlimited glee episodes could watch forever gleegoodbye
1403,penny dreadful temporada
1754,chuckle scare
2346,candices stand pout face aggravate every week
3477,brilliant werent make feel v dull one tattoo emoji thisll x
2277,flat party instantly get bollocked
1513,school photo honestly horrid look ew
3226,rough situations around schalke werder bremen start campaign bremen dash late new manager
2800,peanut butter take away sting
1591,cyber bully
2098,smh remove ideologically bankrupt opportunistic establishment theyre burn bridge social contract anger
643,use warblers set glee episode acapella college kid
1391,sadness leave break bed hold depths despair name love
2121,definitely feel irritation today lord give strength
2941,stop dont make laugh im sad
884,wish could convince rest children go fuck preschool elementary school fear gun violence
1881,anyone else find anniversary windows update complete
1792,airplane wifiridiculous americanairlines americanairlinessucks aateam
1146,greatest fear dog know fear come back go door without n stanley coren
2197,never forget live cancel program allow extend people could call detail outrage behaviour
2141,maybe also attack toms rabid fan amp clothe always perfect also put
2572,remember guy get angry keep say gary sanchez best baseball player world lmao
2040,poor package amazon fulfil seller furious much
773,much news pakistan afghanistan etc need cheery news frybread stand everyone media grim
1894,ok ok know last tweet
1819,thoroughly enjoy ahs tonight ahs horror americanhorrorstory
1066,yall mean riot fire start business burn loot assholes create blacklivesmatter terrorism
1238,replace carpet shock
1401,go alarm
2321,accidetly dump boil water
1158,donnie trumpeter vapid vacant vile viper slither landscape play gear fearful afraid
1093,get reveal tax immediate danger u answer
1687,refs gts favor tonight
2570,yep lol bitter
2753,take man suffer ignorance smile matter say
1043,theres always one song make turn radio youd rather sit silence awful
1326,trump make america great plan exactly like first minutes movie childrenofmennncages terrorism refugees
2637,haters teach hate show love good quote go comment tiff treat
3049,sad man leave work little bite late worst fear oh get stop police ourworld
1879,really wanna go fright night thorpe park next month
1310,false alarm shes come today
1531,candy corn greatest candy world come objectively terrible
2031,bad news order online hasnt go happen order phone furious
2657,tonights dragrace allstars episode give life yaassss queen teamalaska teamkatya revenge bwahaha
2984,thank shall mourn
156,day harvest listen sound chopper work way closer home make happy farm
3492,love word fret much im heaven
3224,fight racist girl stay gavc get kick call bs
280,know script ego maniac elate hear devout christian like phenomanal
379,im gutted love cheery disposition
48,retweeted gunnysmith like today happy alive bless
2139,really need pout time get nerve gbbo
3289,sad white sox play record
2811,help maintain boost status world class centre education culture tolerance
1834,usa embarrass watch last time guy game horrible joke
492,break heart see people upset try best make smile cheer
1828,view human dynamic expression cosmos exist within humanism
646,boro os could give stewards good work chelsea get k lively
3273,blue blue
1056,massive argument alarm today didnt want get dont know go fix tomorrow morning
3348,remo williams ever actually save anyone sulk around kill random undesirables
3238,youre sadly mistake think id make tweet isolate comment random twitter user
911,clown neighborhood creepy enoughisenough
3241,like mop around episode moment emotional weakness felt sorry
3396,ldf shall weekend spraypainting greenwichmarket core lilylou fret amp benoakley
2815,ellie give load gift note em uni n burst tear love
676,drink watch youre worst way cheer
1918,walk dead mr robot american horror story merlin
1040,todays alarm show unprepared professors students come emergency protocols dont know go
61,way im wear smile give today n
2829,feel worthless always
2205,apparently contact sofas mean deliver today old ones go sit floor sofas
2609,schneiderlin take revenge foul
3192,sadly constitutional right abortion yet constitutional right life safety net protect right
1247,americans whole part feel borderline despair least look situation control
3213,charlotteprotest u wait facts video u hate ask question later protest policeshootings suggestions
135,make giggle glee
549,lol ur caste even whole village die massali like cant chaudhry cheer massali
3518,optimism may sometimes delusional pessimism always delusional alan cohen believe
207,ill cant wait mirth
1712,lose blinders
360,untill today anyone ever say remember years ago meet n like since cutealert
1823,everywhere go air breathe taste like home restless
374,wrinkle well look like name start letter g eh man smile give hearty
1673,bully
153,yeah play well
1077,panic attack call real fan make mad like dont even word explain people give
3608,thank much home stun happy dont think sink yet wow
