,cleaned_text
3383,thankyoucgi grow weary good cgi
572,want playful relationshipnme kick couch
2281,leave want play heavier game need offense tho amongst others
1427,obama admin reject texas plan refugees vet terrorism texas pull feed refugee resettlement program aid terror
304,theres specific joyous song title engiybhekayo yasezayoni need le mood
1144,lool soon man start loose weight panic
3482,together hermione lower voice slightly sound somewhat bitter perhaps even rueful would get
1697,ready sweet princess arrive ill weeks saturday excite nervous
1014,date glove box pure panic excuse gbbo
2196,pay chicken didnt even get go dollars customer
1670,new campaign slogan ideai know trump yourefired deflect
1919,thank big bro shake bake help
3057,lose geelong football team nlast see enter banner sure theyve since unhappy playwithsomeheart
2561,offend u
3599,even fight im laugh probably serious ingrain issue
838,beyond mad lose track brown spider brown carpet go sneak
1626,radio tell lady gaga go country like beatles decide opera sing final albums awful
1167,days use term terrorism many address form opinion form terrorism world injustice
2358,imagine twitter fume corbyn lose election smith lead labour worse result suggest corbyn imagine
1748,look massiah youngleadernpakistan massiah
3540,howland cultural center beaconny vickie raabin amp chris raabe blue soul pm
2666,wouldnt bring touchy subject people get way offend days
1343,canada drive force democracy freedom right instead help dictator misogyny sharia islam terror polygamy
565,one apples attempt make muslims happy
1877,jorge deserve honestly hes weak revolt dayfiance
146,elate sid espinosa ready inspire innovative students
1740,anytime get near mic someone need smack w bat marblesinmouth
2250,outrage pass replace mute fatalistic acceptance current situation fatalism
58,happy come across notebooks handmade would love talk musthave want need happy amaze
2230,give kendrick lamar eat barbecue bitter
1524,regardless let say permit permit doesnt excuse allow threaten officerexpressed impliedw
902,im get nervous first anatomy exam
2161,half epicenter shut police yall burst tear fuck terrible keithlamontscott
556,riggs dumb ass hell lolol lethalweapon
812,quinns short hair make sad
1705,better really stupid dont worry
145,positive cheerful grateful expectant success leadership
3308,like keep grind boy life change one year even dark sun shin somewhere
3584,air radio film lot fan pond wales
2072,multimillionaire spoil brat get self righteous huff bc friend muslim non starter bye
3222,haha sorry grim even disturb amp im start lose trust twitter generally
2512,relentless pipe thirst shelter
2136,joke cut internet early mistake dont reinstate longer need engineer fume
2242,rip black men womenchildren kill chicago outrage
3391,hakyeon take attention happily perch wonshiks shoulder sulk jaehwan accidentally cause tiny explosion
966,isis reference scrub federal complaint suspect nyc nj bomb appear omit terror name bloody journ news
2050,bus unreliable e ticket app unable get two bus late work fume useless reply
2697,ehhh guess want everyone ive ever burst laugh front
2788,live event brock vs orton saturday wwe network need wwe
3016,fact havent wear bra week know ill start wear one tomorrow depress
1580,goksfillyourhouseforfree retitled fill house old trash repaint junk trash
505,im really hit flavor sparkle water rap know whats trip half french spanish flavor
2835,panic attack worst feel really sick still shake sleep anxiety depression
1701,funny hurry plenty time stop threaten people
512,cheer clap assume
220,chirp chirp beautiful white red bird
1208,still wait see make appearance next week two months today order shock badservice
497,never make decision youre angry never make promise youre happy wisewords
2817,wrath khan one best movies time
2374,despise lord discipline resent rebuke lord discipline love proverbs
1498,indians hold head high stay unafraid unga wellinformed pakistans terrorism business deception
3497,peoplelikemebecause unknown reason try discourage
1463,walk darkness despondency scverses ive memorize shine light heart ex lam
1812,hopefully ill get best buy job officaly start stream career work towards something love dayatatime
540,thisisus mess mind amp im anticipate next episode apprehension amp isthereahelplineforthis
1197,home heart lie love little island birth city aint act right amp im feel good restless
3281,try give time sober wait friends house hours later gal wake nap vomit
1406,police credentialsyou litigator nothing moreno experiencesad trumppuppet felon bully jerseysale
1630,kid pool yell get foot ass shutup parent kid horrible
2765,take jk fun relax get massage two chill dont eat cucumbers place frown
1663,let refuse live fear ct
2555,look especially lovely sadly remove potentially indignant mr convo
2993,go back weeks start seriously dreadful
1916,hey turn kick way go texans way go texans noheart
2734,dont bitter
1869,sure men handle woman thats get crap together independent
1003,im afraid shes goat libel people afraid goat libel
1152,feel like ive worst night sleep ever great london brighton cycle ride k apprehension
2791,gameday vs buford today home never excite
3227,dont blame speak room kick chair beneath himnamwriting dark
1865,goal scorer vidar kjartansson come favor dor micha another terrific performance yallamaccabi
2059,fuck coupon goal rag
3157,well unhappy way play right
2134,black people still fight recognize human be cantsleep
1848,research determine laughter actually
2872,well evaluation come back minimally effective student test score parcc sink eval time quit teach
1029,terrorstatepak r confirm navazsharif post graduate distinction student university terrorism cant spare
3173,finish write second book tonight somber sad youpromised havemercy author writer needpublisher beingedited workingonsidebook
1098,whitepeople afraid large blackmen
3553,dark side moon fact darkngerry odriscoll end dark side moon
2953,haikuchallenge haikunnthe crisp autumn airnmy freedom purchase deathnno one mourn
3083,right may sufc fan football maybe shit marcos rojo mufc shock start hes dreadful
2118,congratulations free month activate charge month absolutely furious
1142,however agent inauthentic sister still love amp im still alive guess wasnt bad socialanxiety anxiety
272,object literature make man wiser happier poet make us happy tell us may become
1889,dont let behavior others destroy ur inner peace dalai lama heal depression intuition meditation book
896,id rather leave child shudder
2748,need new outlet
625,preprepare direction play hale hearty situation childs evolvement cmmyd
1355,two congressional hear usa stop financial aid pak ask prove enough stop terrorism n
488,good thing sick cough like ab workout maybe abs define time im better optimism
1704,dread call lock
819,quinns short hair make sad glee
1664,ive use dey know alarm clock song throughout college ripshawtylo
1660,really care like state would seriously address sensitivity train employees
471,nits alright say cheerfully try make moment fun
6,good morning love happy first day fall let make awesome autumnmemories annabailey laughter smile
3141,gloomy outside wish cold look
768,shanghai chief distract levity pampa proper dingle carry away uudqujcia
2012,someone let snake house bet kill bugger get hand rage huckfp
2602,eh well sting vs cactus loser leave wcw match bash beach lol
1058,never think angry oompa loompa would boggart boggart presidenttrump nightmare
1261,pm sheikhhasina speech term terrorism global challenge urge world leaders work together unroot everywhere
343,watch amaze lively broadcast musically
934,background suffer bite time stress always bite shy years ago age make redundant thats start
1110,rojo shockingabsolutely shock
248,something v satisfy open old dodoc file able check things do
1560,couldnt care less gotham havent watch since mid point season horrible
318,find marmite australia
2020,im angry
2646,nurse practitioner look pretty bad offense course nnthank really add spark positivity need today
50,thank balloon today smile goodday
2917,baaarissshhhhh sad song prefect night feel alone
3494,serious
1965,pull tonight make car shake
503,think really need round vs twitter debate end something joyful ya know
764,u always gotta attitude tho cheer
3140,u grieve someone legally wasnt person yet
2082,im fume ball anger today
3601,never dull moment talk nell
1533,alarm clock ring morning n flatmate knock door ask set anything fire im burn alive
3381,practically obsess think departure make feel melancholic grateful safe journey
3471,bow moment rather sulk im go opinion guy study oligodendroglioma amp amp
1897,chris williams yards shy join yard club bowman walker amp roosevelt already cfl
2995,havent watch favorite youtubers months honestly make depression much worse
219,watch jubilant scrum end day remember theyre still kid priceless
2004,im fly fit rage fair
1306,wait didnt get case ass donald trump call terrorism facts guess ok
1413,confident bitch scare
3096,romero fuck dreadful like seriously month old better
1411,thing scary arm man try scare someone fact feel arm good tryin scare someone
2559,trouble feign anger give look tell behave know wouldnt though one
698,meanwhile socalled fan sit knit sleep sure certainly cheer like team fan
2132,people irritate
1903,learn years ones mind make diminish fear rosa park quote motivation
43,well do ladies great award amaze team delight present award
2023,way ur angry literally feel ur blood boil
2264,yeah ive see float online theory probably make bitter stan ignore pet v vet crap
702,fee otherwise trick palm oil delegation mt jaunty resident tzxchldaq
1679,terrible paul deserve win bbfail
9,think holiday could get cheerful meet thenicebot
1231,cover milo might make sense much even celebrate puckish cooperation something ghastly
2075,complain time wonder people never want see acc rile stfuuu
108,use smile change world dont let world change smile quote actorslife love hardworkpaysoff fun
1767,stay jade everyone
2636,candice constantly pout gbbo
1426,quite simply worst airline worstairline ive ever use appauling dismal beyondajoke useless
3254,doom gloom want hear lovely things airbnb
3210,dull sleep hourna crew patch rude mechanicalsnamndbots
3010,dont think fully sink val go yet
2973,loyal heart concern somber
1644,today drag
420,sparkle look like gay vampire
2409,wish sis midnight receive reply nd sis wish get reply know whos fav offend
2671,remember tas gamedev program say temper tantrums class time lol
618,sparkle water nice know try day
147,hilarious
2604,rage rage ep come soon ill keep post youtube youtubegaming
652,heyday could go either way write stronger dont know sacrifice first
2494,feel travel miles pick form arrive post two days leave
382,think try comedy youtube always fond time nut comedy maybeoneday hopefullyfunny lol
3436,serious respect man pull bun better like maybe teach ways
150,way takerus eye sparkle eat like cutest thing ever
3104,ive get teampaella present way fi dont think theyll arrive saturday sadly
1101,give think khalistaan nno concern baluchistan kashmir issue
1855,problem yes something worry
442,nwho nose scent roses wentnto spot orientnmummifiednin rapeseed oil friedneating drink amp merriment
2550,pretty average klitschko fury k joshua white k
2282,offend
2085,turn surprise late work fume
1963,dont worry youre best something love youre head right direction
2504,cancel cbs access live feed jc even say vic afp paulshould imo
31,happy birthday hope wonderful day fill lot joy laughter lt despite tumblr jerk
2930,sad
1656,want say social media bully stopbullying please kind eaxh lovewins
2807,follow snapchat carlabtst snapchat snap
2517,think paul whats bitter pastry
1460,fair say hes bite timid compare ive know see
2516,leafy roast pokemon go kid outrage mean relevant yi mean kiss
1791,revolt cock think im sexy
2215,someone make priority list things outrage order outrage racism animalrights abortion cop
671,actually maybe suppose die donation save live optimism
3567,rappers stay true game rich
2135,swear block im go hit back revenge
149,ukedchat go outside gym hall play n education learn
568,regular cheerfulness emotion supper give ladies soon entirely
2858,ring ring depression
1177,home heart lie love little island birth city aint act right amp im feel good
2362,grudge youre hold keep make appearance god want deal
2830,fibromyalgia really bad lately good mental state feel overwhelm anxiety bipolar depression
2095,someone need tell candice shell stick shitty pout wind change gbbo
252,hope never go day without something make smile deserve good things please follow men n
858,literally shake get ekg do lol
1698,word today amwriting horror novel magnitude total far kish go
3305,already plot next step get cut minivan tomorrows dropoff line preschoolpolitics momthings serious
211,bring back great memories hilarity saturdaynightlive
593,lie cut years age young spry hireable hollywood thegoldbergs
559,coworker look phone say cheerfully oh look kaps get death threats go say ers
90,thank disney theme episode let discover amaze hilarious
1836,try go home tonight run nd run rd thats champ sike losers
473,watch amaze lively broadcast musically
3507,get little pout
3329,sister canadian player something shady jonathan toews frown doesnt know worldcupofhockey
2971,ew omg grim
2465,welfarereform model snap
2808,vale vale sip sangria taste tantalize tapas fiery flamenco nights minutesfromhom silverlake la flamenco
551,rip heaven rejoice theyve gain angel keifer family prayers
1962,awe thank much lyle youre best
394,go check bf hell give u strength one smile topno
3572,grateful novel award promo rt bless dewayne hyatt hippie love grind blue florida
3169,dull
3503,discourage slow sales market test business model pinpoint strengths weaknesses
1373,wanna passion fear
1685,revitalize clevelandhustles daunt task hustle
3414,find first episodes bojack incredibly funny get less funny stay drama
517,fault im observant think im sorry wisdom laughter observingyou allthetime becareful
2547,let rage
2831,im think ima lay bed day sulk life hit hard rn
1851,hey yall announce like immediately ask nice thank yall
3532,play bridge bar sit th sept blue rhythmandblues ramelton donegal
2869,depress
1786,oh get see texastech play tonight texans tnf texansarebad
3374,doom gloom score open play concede two time progress mean draw saturday
2195,tell happy anniversary u happy bitter ampalaya paitpaitanangpeg
3100,sadly best days behind
65,thank happy birthday well
3291,naoto nod also like tha band also frown band papa roach concert
798,three days month two ex wive home could worse dont know could oilandgas
1640,nap day comfortable sleep night youll never comfortable
1041,think becz u much terror pak nd urself leader u forget difference btw leader nd terrorist
2447,forget mention buy dreamboys ticket rag
883,ban go harm many people disable veterans people chronicpain anxiety iamkratom
3048,genuinely grim stuff century history sell porn baron twats minty new stadium urgh
2939,think swallow swifts go photod nights ago see since sad autumn
937,could pop round nightmare
3610,thats pretty love sky background purple highlight dull color great
3551,anyway im car furious white men really funny story tell im sober
3371,damn gud premiere lethalweaponfunny serious
354,quotesoup happy everything good see good side everything optimism
2732,well line swedens goals sure sting
1297,dont know expect brendons video lmao la devotee video get shake panic
2486,would furrow face would redden protest would seem see unattractive wukongs eye
3426,name lord amp saviour harambe pray bless ape across worldnnhear solemn oaths pardon sympathetic hominids
3162,xdd song weary
2717,anger cheap politeness expensive dont expect everybody polite thoughtfulthursday anger politeness
2157,always unhappy easily offend
15,love much smile
3091,please bear im twitter savvy real life im facebook person help gain followers blog selfhelp depression
3045,doe run opposite side
327,watch amaze lively broadcast musically
2086,police officersshould right shoot human be without provocation wrongnn
3582,hannah stop mournful chill
1480,bower go drive even horrible
1385,wasnt joke bully
627,hes luckybad pitcherswhateverelkracken legit future bright gottawearshades letsgoyankees
1096,pfft anyone undergo constant ongoing horror sapient consciousness trust themself anyway
1022,never find exact emoji im exact moment need panic
845,much trouble dont think rev see funny side project nervous
3038,ms btw lie remain dry remainer tear accept lose
3275,dont look youll unhappy nnnngh get email notif thank
748,actually choose drink sparkle water
1039,cant imagine keep malice brothers shudder see siblings estrange
2461,wouldnt date
3402,us bear generation genless tribe ha survivor lose sole
1175,get alarm
2386,id give pout firm
2338,hudcomedy adamrowe insult slutfaceshlongnugget
2000,fuck boil inside gonna good let
227,pop half bottle sparkle gamaynoir westbank evenin folks nbcwinechat
244,much hilarity one day
2411,cant believe achilles kill
3338,need serious nap rn
2307,actually arsed sister sometimes control tv time watch one thing get huff
3237,tend hes go get infections nnhes frown look nit must hurt damn
1268,horrible experience company like goldmedal horrible sales person wrong commitmentswrongproduct
1434,tire restless community human tire ask change ignore
642,load mirth trust websites lkskqufke
1410,lmao person must hate bad talk shit behind anonymous account awe
402,plus hearty pour yachtrock mustacheharbor
1893,yo yo yomy name darthvader ni feel like need puff inhaler im rapper sick bar breathless bar rap
387,promise restoration nation israeleverywhere look bless barnswine overfloweverything beautiful joyful dousee
2074,dont provoke anger
2039,lose couple niggas want revenge put coach
927,maybe send good luck job interview tomorrow nervous
296,smile every morning positive head start clients relations
2078,wallah blood boil need take nap ugh
3405,learn use twitter lose
2185,love black people really really people really irritate live hell outta cause im different
2682,wise man tell holdin grudge likenletting somebody live inside head rent free
3463,dream last night chris brown create diss track drake rihanna call hit first dark
3401,fret scuff take scuff come phone use wet hand drop toilet day
1387,tmobile store original note customer zero result whats go guy customerservice hour waittime
67,php though kardashian stuff go head youre hilarious like gleeful little boys
2482,best revenge get good woman move leave hairline figure alone
1846,yeah uk quite
917,ughh want like nightmare get along
3290,sorry hear issue make feel dont like hear customers unhappy
666,may send copy herothegreyhound either ebook real paper one boy greyhound smile tear
3495,first time slough check new station floor lifeontheroad
3063,gonna loooooong year brown fan longer normal thats sad
3398,could work serious
1509,ill okay dont worry
2313,ill happily rude people personally insult unprovoked deserve good people deserve respect
2838,age see gray gray bad eye perspective depression healingjustice
2010,still cant log fuck snapchatsnapchat snap
1089,feel awkward im timid everyone
113,lady xmas dept answer call hello mrs xmas yep true story win xmas cheer goodcustomerservice
2704,anger cheap politeness expensive dont expect everybody polite thoughtfulthursday politeness
2140,ever put fist laptops screen time new one lmao rage anger hp
230,like optimism
3119,nature look lot greener gloomy dayz
1275,someone tell theyre go tear apart say tall shock
2944,literally make depress tbh
1811,dont know patronus dont think tell
3427,say attract see maybe shouldnt pessimist dont wanna take chance lol cant wait relocate
1280,absolutely shock decline rooney little embarrass really
1788,dont let fear hold back want use power push towards goals fear action fear
460,watch amaze lively broadcast musically
3203,ffs dreadful defend
2244,hit children discipline youre quite rag hypocrite youre
480,human race one really effective weapon laughter mark twain
1203,pastor feet away shoot victim protest say skeptical official story charlotteprotest charlotteriot
22,future plan feel much happier goals life happy igotthis yay
1604,nigga horrible bro
681,heyday race war
1525,really care like state would seriously address sensitivity train employees awful
1143,first take room wanna beat bully
1906,awe im sorry dog cat amp snake
326,watch amaze lively broadcast lively musically
1772,couldnt care less gotham havent watch since mid point season
1806,wonder point bobmarley ever actually become afraid high hed get
1989,im block everyone everywhere post storm think everyone aware damn rain quit damn
1287,entire team coach play coach scar jumpstreet
2247,bloody right
3252,go pet supply plus tonight work feel lose confuse
1696,yesterday finish watch penny dreadful beautiful things saw one question remain writers hims fan
2424,lt feel everything would remember everything evanora hop would serve fuel creatures anger run rabid gt
2062,worst juror ever michelle nicoles biggest threat bitter bb
1896,yes indeed know mass students would excite see need get sort haunt
2318,resent
2239,miss fact burkeramsey swing amphit sister jonbenet face golf club previously fit anger
1839,thank get back exemplary customer service loyal customer jk residentadvisor poorservice
962,think nausea headaches pass lol feel awful today
2870,lament nsaddened heartnso far amp nyet nearnthe years sontough amp scarrednthis lonesomenroadnstill fear depression nnpoetry poem
2679,nits always fun anger old dudes rock n roll
695,nonpermissive environment also call battleground milspeak
2345,team must draw hat daily personality drug yeller quiet screamer
2708,least character fast furious pump adrenaline franchise thats
3257,totally get youve say donuts time one week lose lbs get discourage linear
888,feel like ive worst night sleep ever great london brighton cycle ride k
3193,inconsolable gif context
377,joyous occasion laugh ostentatious display disrespect bruce scoff entire scene wasnt batman
1489,romero rojo blind memphis rooney nearly start line wanna punch face rather shake hand
251,watch amaze lively broadcast lively musically
2506,lol im happy negative realistic ass self sorry offend
3170,george h establishment unhappy trump campaign brand son lowenergy could beat others either
2772,forget nice area fiery hearths
1082,course day potential leadership excite nervous proud
3417,never switch stay person since day one
802,want get cake sparkle candle doesnt like cake ruin everything
3264,friend lose hisher phone long mourn lose phone ask earpiece
2276,lowkey forget twitter dont follow back im gonna offend
948,focal point war lie terrorism un need address violentextremism
3098,friends tell im pretty trigger tell im ugly first confuse realise im pretty ugly tru tumblr
2553,tonight legit cant wait rage
3489,wonder guy break penis sex serious
684,u use chirp drink u hoe
1777,im feel
3550,let mrrobot binge begin nerdshow compel dark
1417,gadot please put leave turn signal williams ivan allen jr blvd absolutely ridiculous atltraffic horrible
1059,beyond name amp sham lie vast space bw sanction amp terror statev wait til others impose itamp hv courage
2874,oh get depression happy dont think ive try thousands time already youre help
1363,whos afraid clownsncomment
138,wake dream laugh something stupid make laugh
1860,yall remember mlb try futuristic jersey
1361,trump afraid big bad hillary election presidentialdebate presidentialelection orangehitler skip hide coward
3605,red one would look super pretty bronzy glowy nude lip makeup look rd black would pretty dark lip
1597,think daunt fact typical offer grade even though prove case exactly
2959,dont know whether despair agitate cull
3541,ff nn nnsoul blue amp rock bandnnmusic heartnnwith soul amp passion nnxx xx
3201,funeral close casket want play call record complete lose podcast talkshoe
1764,smackdev ptp start word
369,much cheer see
2839,idk start feel depress sad lonely
2320,disgracefulesin resent men way reason esinscountdown
2740,firsttweetever sippin hotchocolate wonder finally give lt haha hellloooootwitter facebookisforfamily
820,hate overthinking e v e r h n g like jus wanna happy pls
1337,say third city kit fuck awful someone nike want shoot
30,retweeted gunnysmith like today happy alive bless rejoice
1080,terrorism shouldnt way life unite etates wasnt islam bring islamexposed islambacon
2158,shameful display watch today leave reel much anger dt feel like explode clown watch
1078,boy nightmare
3061,awareness time awareness time lose awareness time lose
206,show us really lively performance lot different emotions stick one thats freak awesome
1198,purge real kenya would country elite purge choppers lowclass cower bed hours
2304,im use pretty girls use curse word express anger feel like im little bite surprise turn well
2455,get angry tell would year old guy look girl like felt
3592,good morning chirpy springequinox pensive sister autumnequinox perfect day however express thebeautyofbalance
717,possibly kg buy player buy glen minority owner
1612,monday face would punch monday face punch fight joke like firstworldproblems need coffee asap follow
1750,com sede de milk shake
1398,miss th test match today able witness like watch india shy indvsnz thtest
2588,bitter battle sweeter victory
2812,one favorite songs brother real talk
644,assure eventual destruction would interest public cheerfully accept sherlock holmes
1749,make breathless
2453,belittle kitty straight service provoke lift aboard wycelv
3228,call pessimist dont think therapy fix whatever wrong anthony weiner
3415,dont know everyone pretend sad angelina brad everyone know dumb ass shouldve stay jennifer
