,cleaned_text
3421,im decode blue one get blue
1094,unruly kid morning nothanks rip flower bed root parent watch shock
197,watch amaze lively broadcast lively musically
3446,dont expect women violent amp discourage really raise boys
88,shes sweet amp playful
1057,stick runway divert fargo continuously tell mins past hours foodwater offer awful
111,great train course lot photos fun laughter photos soon boostercourse fun
2515,seem like fight ready rage
2501,paul forever paul paul play better game bb
3533,oh goodness im love rainy day head creative cap amp get lose thoughts kind day art create biz
1365,express deep concern suspension please reactivate never violate troles
859,thank ryan amp brad scary shit us first episode dont think heart make horrific
795,turn wasnt even anything concern im happy bite frustrate take long get answer
2900,groom gloom
835,im nervouswreck im nervous pileup goingcrazy helpme insane antisocial
3431,heart leave long againnnslight pout turn smilennheheh kid im fine
3515,cant take u serious unless u use emojis
1170,fact presidential candidate speak way trump alarm think higher peer fdt
744,obama describe temperament steady amp buoyant side
2218,wonder would happen tell people truth savage uhoh angry
2620,test current earth burst team
1959,cant start good day without cup tea nntea start day goodday
1569,great defender terrible position didnt know without russel shout mins
509,watch amaze lively broadcast lively musically
2622,also ppl love whole damn lot erica joanna tiff sirli harley anja rest gc bc run chara
292,watch amaze lively broadcast musically
821,people cheer sport team completely outside new jersey pa piss
909,interview scare crap never imagine many dumb dumb americans
3242,im confident never experience successes last yrs best hope another bournemouth
1262,yall crackheads islands dont know find interest shock
2308,first expac since wrath feel like proper evolution game
2365,spend shimmy drink ill rag know gonna happen
3416,pine nut chestnutpeanutwait wrong film
594,yell bye garbage cheerfully
3538,blue bob haddrell amp guestsnfri rd sep pm pm blue free tunbridgewells
3460,sober life
3560,joyful hope patient affliction faithful prayer romans
920,dreamthey try steal kidney nightmare blackmarket whydidiwatchthat
1938,awe thank girl
1547,mind always seem work best night restless
1447,petrify fossil type way
2145,forget eat dinner im furious everything everyone
1742,anychance address communication send yesterday still havent contact
2908,even hard facts dont seem sink despair
591,didnt many chance show look lively good shoot tip bar end
1263,u shd b embrrssd u jack bp meds twice still take days express expressscripts
21,wake dream laugh something stupid make laugh hilarious
293,make successful happy forever
4,feel bless work family nanny nothing love amp appreciation make smile
2490,yall find express yalls displeasure
2988,man southampton wipe floor west ham sunday dishearten
1942,shy come shell thats
590,betelgeusesloth lively dedicate tenacious regulusgreed humbly content leygluttony starve hungry
1779,weeks problems week unbelievable guy even run regular bus solate
1556,concept gay magazine feel like cover terrible people gay voice seem upside
3424,preparednnnot far know dull reply still survivors members like say
3325,lose wallet lol
2015,feel furious
3500,lmao imagine frown across face hilarity
2692,never make decision youre angry never make promise youre happy wisewords
3158,guess must really expensive whole family stay poland really miss
1046,operation echo gather momentum tense feelsick excite
125,simple human really love like truly madly deeply rejoice existence class queendom
1476,banter craigen sutton bt fuck horrid
2476,tiff better hurry cause
3,thank much gloria youre sweet thoughtful make day joyful love
1246,offer moth warranty pspro shock truth ripoff
1654,pretty sure golden ticket get tour make mistake something horrific happen good day sir
489,im laundry watch show bunch strangers happy birthday
1733,wazza block carricks shoot miss sitter memphis ready beside surely wouldve bury good start lol mufc
2070,wee pop sock keep fall inside shoe rage
686,waxen mirth neeze swearna merrier hour never waste therenamndbots
1948,ha get book meet starbucks nola josh say terrific im
46,love cheery adore get every time produce new content
64,get comedic relief w season premiere modernfamily girl need
1153,discipleship train detox something messy fearful cutoff choosefreedom cryout
1052,terror test
392,treat viewers watch u janak simply treat soul mind thoughts hearty respect
519,incetown age joyful elevate hope
2595,fret scuff take scuff come phone use wet hand drop toilet day
2584,terrible thing see visionnnhelen kellernnbegin end mindnnstephen coveynn whereareugoing
3286,lose heart dark underneath star
254,rojo hilarious
531,quarterback wreck every time glee
176,ability make someone happy make someone smile world need right createlove
3310,awareness time awareness time lose awareness time
1545,never find exact emoji im exact moment need
337,drunken patroons make whole situation much jovial though
2131,yeah receive fine today furious currently appeal member long
2802,jar snap
1952,simple get two shots espresso grande decaf degrees soy americano extra foam barista
638,well heyday im afraid expect st baby reckon age gulp im old
1322,think leave part life behind menits back haunt every girl love
2315,come let make em hate make em pout face
2042,make fuck irate jesus nobody call ppl like hajime abusive stop strawmen lmao
3488,ya boy get mad tire pine tree
2211,prudence suggest bump weeks view skepticism mediahrc axis angry
3267,old person cant handle stufflol leave get back youre sober
2143,nobody street burn loot terrify innocent citizens either
287,hello miss lady im sure today bring happiness laughter use voice also make us laugh god know need
846,im cry katherine one whos like talk anxiety attack im gonna faint
2970,weeks full mondays end
3283,first time slough check new station floor sad lifeontheroad
2314,ak leave spine frown
3437,transparency openness dull sell fan group want verbs like buy defend build secure
2947,break hearted lovers cry away gloom
3593,also amazon prime would like help girl lol serious
2761,espn assume want free magazines
809,study phase oscillation jovial
1727,want dad play kick baby little one southpark mellogang ghastly edm plur dad djlife dj producer
2799,follow girl tiff get followers
1581,musician tell people get discourage learn shitty instrument anything else
1880,fear block bless faith unlock manup faith
3142,lose bag stillwaiting go home indays dmd info ring time day wheresmybag
1151,harbor osama bin lade relationship haqqani network enough evidence prove pakistan sponsor terrorism
130,contentwiththelordsportiono satisfy us early thy mercythat may rejoice amp glad daysps gladness joy delight
919,jimmy carr make want cry cry shiver
1085,jimmydore raisingtheboss weve already lose country government oligarchs fear tactics still work appear
524,look like book shape like gun optimism itsagunalright
2208,get angry tell would year old guy look girl like felt offend
539,decide stop afraid stop free donn brave free honest healthy life live love
3118,send pitch brand close tabs relevant instantly thats kind detachment create serious
2875,im really constipate depress
2743,kik want swap pics post account anonymously wish kik vsvplou kik kikme snap nudes tits snapchat
841,get much pussynp panic attack nu uncontrollable anxiety ns suicidal fantasy ns sadness ny yearn death
59,second day job already get dollar tip dude whose constantly twitch eye lololol
2762,luck rest fall go anything like today think im go like season bestdayever magic work snap
527,intermit animatedncaa pittsburgh vs mississippi sprightly shiny bbva level peg varsity football telly scra
938,im shy irl lately feel like everyones thing dont fit anywhere feel lonely
1784,whole team limit theyre field
1255,terrorism intimidate populace case hold coercion people uniform per se intimidation
563,cheer
160,day elate im take pto tomorrow im doneeeee
2537,projection perception see someone else also level within anger worry
2422,best revenge move get continue succeed never give someone satisfaction watch suffer
8,get back see burslem amaze face still hurt laugh much
3138,still wait yang guess really need sleep something kitten feel kinda deject right offline
2493,sun literally burn skin
1595,thank get back exemplary customer service loyal customer jk awful residentadvisor poorservice
322,team world would totally elate get xd
278,watch amaze lively broadcast lively musically
1079,feel like house us basic requirements literally options discourage
1588,kid pool yell get foot ass shutup parent kid
1913,dont ever compare scrub benhell shake whole dl throw td
829,finally tell therapist sexuality last frontier sure fear singlegirlproblems
828,nearly start cry full panic attack tatinof bc crowd feel
1519,hear panic disco kaching atm
935,data steal tell us
908,another test tonight nervous
3034,provide customers wequipment doesnt deliver speed internet service charge scam
1376,especially true impulsive thinskinned bully like silence critics amp opponents president voxconversations
2167,ask parcel deliver pick store address poorcustomerservice
71,funny everyone come life like far im cheerful self confident could make abla kaml fga kda
2702,zumba piyo hiit sessions sweaty burn sooooooo good missedoutonsummerbikinibodybutwintersunbodywilldo
1793,watch tna first time long time hell happen hardyboys impactonpop wwe
1601,read ot pauline epistles countless horrid rule
1325,cant stop racism overnight gun violence terrorism literally stop trump overnight like let imwithher
2589,resent bite tongue
1726,alien zombie gore slash ghost sith horror love
2774,also madden isnt funniest game watch isnt much happen bore
288,thank balloon today goodday
163,beautiful day today cloudy sunny breezy
1910,im excite firstdayoffall amp rest season halloween scare events im cover next week
596,love cheerful woman store someone elses furniture eternity id sell granddesigns
2563,bloke train whos obviously try provoke west ham fan loudly slag stadium mate phone
1453,threaten pussy
810,weve foreign policy goofy secretary state john kerry devil may care pose jaunty blue scarf
3152,im confident never experience successes last yrs best hope another bournemouth sad
2370,provocation set curiosity entity feed fuel fire speak quatrains hmmm america need vigilant
2060,lvg bribe refs utd personal revenge foul prick
2801,hate see yall frown id rather see smile
729,research determine laughter actually anxiety
2639,least rd time ball burst game
232,god replace sadness laughter cant go whole day sad
3233,always sober say youd drink teach keep mouth shut n ernest hemingway quote
2497,help maintain boost status world class centre education culture tolerance outrage
1628,love true teach fear illusion coach courage
1575,forget plug phone overnight
731,let see chirp
3380,erykah badu sedate
2491,get wind menforchoice doesnt infuriate make sad generation
2233,id fume
3196,sad truth
221,minutes yoga breakfast routine change day preparation sunriseyoga bodyawareness health yoga smile stretch
87,cant wait say cheerfully grin
2367,whats w gender bias indignant fancypants saddlers daughter opt leather jacket thank much
3093,put damper mood
2353,yet still deaths road rage amp violations road despite widely accept concept personal accountability drive
246,violently scream four wind aint ever get older cute jovial rhythm start move hips along wave arm air
1584,plus point wont queue loos plus point nope cant think shock sexism
990,get soooo nervous actually attractive guy try talk person like turn habit
3399,tell pine didnt want didnt
3549,strong amp courageous terrify discourage lord god wherever go
3589,shes ahead poll amp trump dismal performance upcoming debate easy win hillary
1641,season penny dreadful netflixwell afternoon fill
1377,recently change worst service ive ever encounter nearly require dna access anything awful
982,every horror movie frighten child ie halloween movies nightmare
2359,scar ruffle feather resort write cryptic code unclecamscabin
2556,momma irritate ask question like go
697,u block doesnt diminish hilarity observationor childlike response
1515,care care tax form believe terrorism job important
178,time go hit library lovely pile book reservations collect morning glee book read
2937,nap days row im unhappy rn
2186,dont talk politics people nowadays get offend easily
1608,sure men handle woman thats get crap together intimidation independent
3022,brb go sulk bed friday
171,watch amaze lively broadcast musically
501,burn keep fuel aflame alert servants master cheerfully expectant romans
2809,grateful hungry people life hungry learn change grow help etc sure anybody better relentless
2148,someone make priority list things outrage order racism animalrights abortion cop
1745,nbecause distrust life argentina lot heart president worth every vote
2564,welfarereform model
1961,ive root since begin bb
694,never make decision youre angry never make promise youre wisewords
1914,shew
685,amp must rejoice ovet charlotte protest nnorthcarolina
752,look like book shape like gun itsagunalright
1559,mary astound concept leftover milk end cereal gbbo
2883,weather sure match mood state today gloomy
631,aint go away dont want see hurt change heartsminds really option optimism
3131,shoutout drink man bus piss bottle seat grim
2656,gameday vs buford today home never excite revenge
757,noah fence want harley quinn blake lively layout
286,accept challenge feel exhilaration victory
1293,worst customer service lack professionalism service provider phoneprovider badbusiness terrible
2055,years irrelevant absolute joke manutd ticket fume noloyalty joke notimpressed
1163,fuck live live admire everybody ever something win afraid even try
1876,aberdeen st johnstone let see punt furthest
3389,aqw shouldve always stay art style competition create detail art time
2822,rise incense best thing ive ever buy
952,realistic probability clown might next president clown uspol nightmare
2975,yes many cop many ppl lose live r still alive
1379,sickness bug
1091,people country million go ruin whole country people
2375,guy across really ugly suit cannot stop express displeasure
543,lol mention pak pm even speech international news channel pakis rejoice world stand
3343,something confuse type entire word see laugh hour sadness almost pass
793,quite saddenedno us date joyous anticipation attend dg concert since happy keep busy
1432,remember joey slag england players bring book crap tournamentssame samecrap player bully
3347,interview preparation hate talk one dull subject matter yawnoff
2052,liberal outrage king say nword really anger white yuppie progressives go fuck shame black
2847,dont leave sad
485,like right way pray right way give grudgingly necessity cheerfully woficc
1049,world face terrorism terrorists school exist terrorists teacher amp father terrorists motherland
893,nlikewise death cut despair
1147,fosu mensah complete nightmare reason northamptons attack come leave
746,check film robocoq shortfilms
1847,open suggestions good horror movie saw follow recently dig gimme something good movienight netflix
1827,world nicole beat paul terrible bb bbfinale jury think
1450,thatll gosh darn terrific check brown people shuck let make law say brown people
3557,dont get discourage early amp get overwhelm keep read amp use cue card itll get better
1229,next month well run overcome lowmood overcome worry improve wellbeing course louth self refer
1550,dont forget test yr smoke alarm carbon monoxide detector batteries could save life lovinleeds
3235,worst possible decision could make arrive uk shock service poor coverage
2149,wow bill hav text u prove take swines con
3247,easily forgive child afraid dark real tragedy life men afraid light plato
450,update yet hang im still hopeful optimism
2962,car dent hail sad
973,terror leaders say dont jump conclusions matter racial unrest silent
3272,dull uk
2667,lose fury fear youll fail
544,happensu ok tomorrow cheer updont give
2344,unfortunately wont end followers whichever candidate isnt elect throw tantrums win elec
1620,get hours go back work cantsleep excite
663,hms pinafore timenni need mirth
2904,horrid disease maternal grandmother sisters suffer affliction hard
1835,would advise everyone wait watch actually dont wait dont even watch
3506,tgif hope everyone need find recovery friends stay sober weekend
2096,turn shit home button accessibility nnwhen innovation become mind fuckery iphonephonehome
803,youre cheerfully defend group unchecked arm thugs whove show history racism violence lie
3164,could crookedstuck updelusionaldimamp dark hearted dud surprise losingampprob also ppl wont let crimes drop nwo imo
778,photographer portrait shoot mode iphone plus go frustrate time delight time
848,super shit tattoo nervous
1579,badslash price send refugee camp like team gear lose championships awful
3255,maybe thats ask study hard get job like way wouldnt dreadful
3554,second artist announcement look good bluesfest music byronbay
899,dream drop iphone break tt cry iphone
239,aww maine coon little name ted eddy wonder cat theyre good cat playful sweet
335,oh please inc talk loot im say bjp pure hilarious irony def better
1997,bloody park ticket fume
667,harwood gleeful new number bet money reportinglook lose liarthiefscoundrel
2339,need help anger
372,annual reminder dont care cheerfully eat anything label
3523,dad ask hungover function today little know stay sober last night could get shit face tonight
3299,turn older woman look sybil somber expression nn run away cannot blame
557,agree memphis look lively also
1512,guy come train smell like mixture damp dog old sweat sewage work gross getoffthetrain smelly
657,dark dense exhilarate come finale hellorhighwater grip watch
72,happy birthday cheerchick jeep jeepgirl idriveajeep jeepjeep cheer
2236,wonder american city next protest police shoot whos next smh whenwillitstop howmanymoretimes
1807,new tire amp alarm system car fwm
3191,depression u shouldnt judge expose everyone help
1639,oh god thats awful mine dont last long thank god thank youn xx
1179,davids anxiety go send home someone also suffer learn look normal essential cop skill survivor
257,better wetter dry certainly find hilarious gbbo
116,still cant get jimmy garoppolo head almost weeks thank lot hilarious
11,mean happy happy
2112,hour football practice boil sun hr volleyball practice boil sun
3408,penny dreadful season
1141,late night thoughts feel restless
2934,dont wanna go work want money sad
2377,think must scare coworkers im eat like rabid animal break srry
3448,jay z brad pitt cheat bey stay angie leave cheaters love lust sex couple relationships date marriage divorce
405,talk problems greatest addictionbreak habittalk ur joysquote problemsolving behappy
1133,didnt concede yet nightmare back mufc
661,drop cheery
2899,one want win wild card play cub road sadness
3282,otherwise youre commit crime soul sober ppl know good bad
950,put passport safe back get back australia problem cant remember safe panic
1925,ready sweet princess arrive ill weeks saturday excite
2567,trumpism likewise rest bed racial resentment make knowingly intentionally long trump get politics
3182,want help depression give office call learn tms may treatment youve wait
3585,long day thank goodness bake brighten weary wednesday gbbo
552,exhilarate hockey theyre still russia win regulation im read fuck
3115,patti seem sad stamp run behind sofa give plenty love affectionmore usual
682,dont love honesty best policy
1979,suppose work wtf dude thank piss
1672,love true teach fear illusion coach fear courage
1523,gadot please put leave turn signal williams ivan allen jr blvd absolutely ridiculous atltraffic
2278,like every color look trigger colorblind offend
1970,fuk heck move fridge knock landlord door angry mad
1209,roommate turn sink foot avoid germs guy say roommate feet girl im sorry plz help nightmare
3106,dont leave
3586,tonight fulford arm york ntomorrow bank top tavern oldhamnnext saturday big hand manchester nnlivemusic punk blue rockandroll
3263,donyou worthy enough know serious
2092,ummm blog say simon stehr fake thill expect investigation forthwith outrage
1464,someone come fright world w
2385,think may offend
2849,week awful connectivity service g im pay unhappy poorservice
3345,pretentious dick night gallery fuck use towel dry sink
1977,track show equipment deliver wasnt service suddenly delay weve already weeks fume
3607,ff love amp support always eliza neals rock blue music friends
2417,thatmoment youre watch worstcelebritycooks bubble burst find kylexy gay marry nochance kindadontmind
632,love dog playful really scratch face flail paw excitement almost tear nose ring
2857,people steal things work quite damper day go wear pajamas day
607,add little levity
3327,feel strongly need work together right dreadful wrong
680,cluck cluck cluck wolf wolf wolf chirp chirp chirp ever hear
2153,cant even right bb rage
3509,didnt impress didnt depress
2548,could get line block germantownbroncos lilleague popwarner broncos usafootball lineman
2698,true reverseengineered drink scientific method hear rage
429,panda eye jaunty watch jaw late
2201,im wait figure im like real quick irritation
1992,get response irate customer amazon nwhy cant understand always amazon faultncarrierfault
2745,wish next madden story mode like fifa
2992,love ex unite managers twitter form fanbase honestly despair time back fuck team eh mufc
2518,dont see think well dumbed simplify offense brissett come complicate system
2954,smokeys dad sad
2130,joke cut internet early mistake dont reinstate longer need engineer
2268,candace amp pout get right tits gbbo
264,love independence msg happy amp fulfil within amp positivity flock independent
1207,way think want absolute hope bear absolute despair
3163,feel grim nail do
648,mean guess mean ones treat like playful want support yoosung without date
2680,bitter hurt lmaooo
1729,drop every fear
1467,u give laura much constructive criticism block u lazy give hope retire heather
3602,never dull moment
2837,honestly depression kick ass lately
2611,angry glass vodka
217,yeah play well optimism
1985,zero help customer service push buck back forth promise callbacks happen anger loathe
1405,shameful distrust friends deceive
1084,man citys kit dreadful
249,rojo bad hilarious
313,finn sing cant fight feel shower spy one best scenes show glee
123,food get deliver
1245,okay ahve start mob psycho today dont im go fight
1996,straight people even arse straight guy think mean threesome fine angry fume
2625,snap seem problem
1335,horrible track lakeside
1714,remember joey slag england players bring book crap tournamentssame samecrap player
2879,applications dbs still wait year go loose job thank unhappy crb
788,dont smile say youre love thats dont love
493,dont love honesty best policy smile
223,man know juggle didnt ball itn funny pun lol punny
3577,stay night longnmade drink strongnfeeling ten feet tallnropes swing waternin middle night
3292,sad film story know could ploy escalate tension unverified report hype
2951,nasty nasty chilly rain put damper afternoon cigar good thing four congresscritters tomorrow
1594,shock work ethic players rooney stifle laziness
348,watch amaze lively broadcast musically
189,always ready smile
2580,love megan rag kendall jenner photo im sit like
2102,irritate inch thick make mask
390,aspire vals self confidence optimism tbh gbbo
2462,team face barca bayern defeat ones face wrath
3385,im sober time get shit face
467,whether rejoice fight back tear god want share moment
1951,make great taste shake word describe shake herbalifenutrition tastesogood nowords
3531,hello fellow horror creepy dark stange story fan hows day followme ill followback
3313,us add years syrian conflict arm rebel army would think iraq sink kerry
2880,miss social media place get laugh jump dms lol shit depress
231,ryan gosling eva mend finally b joyful funnydont bossdont arguedo everything kidsgo mini car trip focus love
1257,ive bad mood week work horrific decide start scrapbook summer vacation
3071,want make plummet depths despair
647,hes luckybad pitcherswhateverelkracken legit future gottawearshades letsgoyankees
3517,eye stay glue monitor turn away anything
1546,stay jade everyone terrible
2654,everyone wigan biggest club
689,close shots ugly mug continue talk blaine years glee dead
740,onesimplechange drink sparkle water instead soft drink steer clear fructose still get refresh carbonation kick
2966,wow almost tmobile store san diego note replacements sadness need get mine replace
2416,thank say wife get iphones today lose eta thank
1469,speech still mark mention genocide indian terrorism pak plan speech
3425,blue
238,geo capable cheer
1100,many sex case u need u guy learn uber shock consumer unregulated
2771,happiness best revenge
2764,grudge truth abundance
537,watch bacheloretteau zoolander samvrhys
1190,ill kill u u bully
2117,feel travel miles pick form arrive post two days leave fume
963,job interview afternoon ek
470,lol sparkle wine
3214,sadly war often factor jump start us economic growth
3351,immense importance football sometimes scary win responsible many unhappy people arsene wenger
2783,important thing bestrong hold thoughts
1392,haha horrific need say glad im away spain sit miss game
2182,dont join put phone talk rude take money acc willynilly
2073,wont use use guy cant get nothing right
2747,intensity play extraordinary relentless aflcatsswans aflfinals
52,today first time math professor let us live early class time min feelsgood happy wednesday
271,untill today anyone ever say remember years ago meet n like since cutealert happy
1382,ntfc mourinho worry bring ibra rushford
3089,whenever pout want adrian appear tell stop pout else
