,cleaned_text
2729,best revenge massive success
3359,im do piano blue play smooth talk ass nexttt
2614,time wound heelsnn drunkjesus rt lol wisdom quote comedy self revenge hate time funny politics trump potus
2209,shoot black police woman typical looney toon think hillary divide chaos
520,rejoice everything time moron take genetics pool
79,great time skywalkers open gym tonight come every wednesday hillsboro train us opengym tumble
1883,huns like box coffee revel
1799,less sugar fruitn less soda watern less worry sleepn less word action
949,grim despair feelingi look self family hubby fight years country ive work years govtgt
2251,wee pop sock keep fall inside shoe
1380,sure ohio state terrible ohio awful etc etcnnthese feel begin toldeo war nnso maybe dont campaign
2623,hurt much eat read somewhere marshmallows good bc soft dont irritate
2913,wish appreciate turn take care want break tire lose
391,depict feel right feel jubilant yet anxious ordunno seem like im something worth wait everyday
465,watch amaze lively broadcast musically
2828,feel worthless always depression
1709,sir concern whether god side greatest concern gods side god always right abraham lincoln
706,mirana tell shut sing along glee
1643,joke pay data im spain text say ive use data terrible service
1689,important characteristic leadership lack fear activism equity revolution
3300,hour play concede less west ham northampton let sink
3215,grim fuck go dame fuck clown take game channel way nj would delete
472,glee glee glee glee glee glee lose lose lose lowe much
2549,arm focus rage overpower get nerfed itll still stronger fury though
669,live life devoid mirth come think arent enough taco bowl life either
3525,tone n favourite chris pine stans love tone anything mt sweet summer child attack anyone hurt
852,minutes perform im nervous wish noise would stop handicap annoy
1319,life become concern irrelevant ass people ill never know
129,love optimism blue moon
2790,pray boy huff
3590,roast risotto sage pine nut
586,ukulele bag fall apart welll least life hasnt yet joysnnquote problemsolving behappy
323,tonight top delight skein geese fly foot swim windermere breeze drop amp become like glass
3353,people want go pine ridge little wind oelrichs start think transfer wanna stay cloud decisions man
141,happy bday bro
3333,serious problems expectation private philanthropy replace functional government servicesthis dangerous
3485,askaman sound like serious issue cause siyahleka whole time fun
2769,prayers amp protection brothers sisters fight charlotte machine
2804,order vacation bath suit one less thing fret
613,talk problems greatest addictionbreak habittalk ur joysquote optimism problemsolving behappy
2648,could sense anger stir within take hand long stay together well safe
3430,shaytan room wallahi dark time lamp omg shaytan
1334,astound respect black vote like human u talk towards bigotry display
1861,show new job youre afraid new task take project brave make impression worktivetruth
898,roommate talk laugh sleep never fail scare shit
1211,vote killary like stick knife toaster makeamericagreatagain
737,sparkle water wyd
256,miss cookie send thank shes spry use like doesnt adventure young pup
1213,people right protest loot amp riot amp terrorize charlottenviolence amp anarchy unacceptablen
541,find way top glee
3068,miss guy always make sulk
2965,sleep cootiesni close eye dream im awake weary sleepissues narcolepsy
2444,puzzle invest open portland feodal population correlative straight snort infuriate xlzjyhg
93,currently listen amp podcast guy please move yvr hilarious missyou
1975,blood boil
96,probably best ot period ive ever see absolutely exhilarate wch teamna
1462,wouldnt cross street piss server dire
1720,much want normal little life wouldnt suit id get restless need want time happy
2496,chris eat mac n cheese imma eat taffy
2495,chop feel still feel sting look brutal
139,love parody account well do vote trump lol
3612,literally eat creamy pesto pasta top grill chicken sun dry tomatoes asparagus pine nut every single day life
3459,dont need mask ill gladly make donation help ur name mr ty rex first initial serious
970,go back weeks start seriously dreadful
3372,make laugh quote sort rueful way
3001,dont see difference court appeal women vs deception amp pressure depress
710,halfway work realize forget put underwearits go one days mombrain toomuchgoingon longday breezy
868,would great card crash happen twice nightmare
1250,dont know make pakistan fear terrorist terrorstatepak
1025,watch follow super freaky movie horror scary
2471,heart leave long againnnslight pout turn smilennheheh kid im fine
1239,everyday gay panic stun draw guy attn block toilet stall crack wpaper towel total incomprehension
2479,greater wrath woman scorn
247,man know juggle didnt ball n funny pun punny lol
196,love independence msg happy amp fulfil within amp positivity flock happy independent
1351,ah grand old paradox fear encroachment state love unconditionally pay enforcers
1653,fear bestbeast product gods atheism theism bible christianity hell heaven purgatory psychology jesus
2677,u try boil em take years
1530,nawaz sharifs un start सत यब धय त र unga speech awaken world role sponsor
385,lmfao racepimp tamron hall use word fscts msnbc sentence hilarity libtard biasedmedia neverhillary
900,delete save file try load start go freak kill someone pray
2265,east wind blue summer durban africa still surf get sting badly must carefulla sting harm
1930,set alarm nap gtgt
2619,believe im gonna start sing snap stories tractor switch little bite
561,prospect get choke hot daddy tonight sorta cheer also kinda wanna watch new ahs episode lol
1157,america openly embrace racism dismay
3124,think val might go week ill take rest week work mourn im sure theyll understand gbbo
2238,im holiday next round fume
862,fear future mankind
3153,whats good already hit rock bottom even though im two season away new depths despair playoffs njdevils
3556,darkest nights bright solemn face light smile believe
2928,cum despair
1932,terrific universitya unique universityathabasca university become part head amp part heart peter mackinnon
1773,use laugh coz couldnt afford junky stare awe win
1181,im shy girl
2616,know cyran still hasnt do makeup base jeongguks tiddy like suggest im
2297,connivers blind existential fury
1813,everything ever want side fear george addair thursdaythoughts yourpushfactor fear life quote
1236,dire need worship session let go everything
723,actually maybe suppose die donation save live
3344,suppose dark gritty though
877,im surround trump voters youre right fuck terrify redstate
2907,health think depression feel like
2958,im distraught candice pout piss
1674,oh get see texastech play tonight texans tnf texansarebad terrible
2643,finally make fury warrior guide let know thoughts
3143,saw tshirt phrase mind dangerous place would like buy italy dont sell sadness
2750,snap andriaprebles
1625,crossword puzzle oat meals solitary respect flat portentous nutrient rootstock scruple failur
3328,name change uncle remus lewis foh theydontlikeyoueither unwoke
2909,depress darker much earlier
2284,irish citizens boil drink water leave one foot firmly bog
3378,like loon attic luckily quickly sink wrong pronunciation still couldnt stop say stick
3024,ripkara could see local mall school football game im dishearten
2336,think come back twitter ruffle bush tuh
2071,majority people irritate fuck cba people ahahah
1155,ndidnt florida teach anything live palm beach county live nightmare
1176,worst thats ive attend worth one worst con ive last years terrible
2255,miss outrage
1308,understand fear factor support company want reduce status needy satellite
2008,mine party decide party slowly transform vengeful hellcult white male resentment
2535,little prick sting come tennessee get
3058,always unhappy easily offend
1852,room would go russell howardtom odellmichael buble pant nogood
577,happen expect thumb place glee interpret double negative
1444,sit wait bus today envelop strawberry scent damp revolt cloud vape move away disgust urghh
1576,follow amaze australian author fiction horror zombies angels demons vampires werewolves follow authorlove
339,cheerful voice echo grand familiar home smile blossom rosy brim mom reciprocate
1805,gonzaga list article tremendous value top team sure get everything want
1526,horrible service ewr cloud sky normal departure leave pm crappy unitedairlines
1001,husband lose book apartment didnt exist didnt care airbnbnightmare
2722,standard candice start show pout startasyoumeantogoon gbbo
2603,dip boil water
3366,gonna loooooong year brown fan longer normal thats
2101,get angry people dont know dont stop sign francis foster road rage
960,india right reply unga pakistan preach human right country global epicentre terrorism
1458,terrible cat wow aflcatsswans
3056,nail half hang absolutely fuck grim even acrylic hold
655,well look bright side find use rope tipstosurviveapoweroutage
2868,think pretty solid gpa kin major look average dpt program feel even discourage
1857,take first baby step let hope start run
1549,peanut butter kinda pervert
1233,hahasorry dreadful pun need get moreive cooped lately
1228,shoutout ruin iphone order horrible
2527,believe women fiery month go struggle struggle develop strong character
2,wait week game cheer friday
2763,newenglandpatriots jerseys look like whack ones try make make custom jerseys madden
2258,luv see man scowl face walk protein shaker clench fists immediately stop n suck dick
3309,get mybrokenfoot run great north run cant wait run months time mostly dark ukrunchat
857,im nervouswreck im pileup goingcrazy helpme insane antisocial
2741,one favorite classic cars plymouth fiery
2727,thank u justin amaze concert cant believe u provoke thousand smile nightbelievetour
445,seriously dig eyebrows
589,random guess potential amelie kenneth rock ya instead tv amp maybe w optimism lara jean
3015,juniors wear purple ollafest im fight alarm need wake german sadness
3470,kinda wanna book vacation goanyone wanna tag along adventure serious
861,weirdwednesday okay jumpscared poop right bad dog bad total codebrown favorite pant damnit
2964,high school remember help neighbor clean back home greenville pretty sober stuff sadness
253,ok champ youll make im cheer far
1345,preordered pale ep would pay phone call would freak say anything
132,thenicebot wsjnordics make world joyful place thenicebot الخفجي
1016,panic attack couldnt find twitter turn twitter jerk still see nyssaalghul
1004,oh god brewer horror horror
2115,suppose work wtf dude thank piss furious
364,another joyful encounter tribez amp castlez meet mouchole ogre cook want know download game find
1578,like commercial chocolate milk bender steal soccer ball guy refuse give back bully
2796,drop snapchat name bore swap pics
414,hes brilliant lose joyous plot us year admit fan
2469,streets rage hard find itunes step guy vinyl nmade simple
1124,anything better trump ramble awful truly truly awful
1787,maybe new start always align end start forward
2053,pay chicken didnt even get go dollars customer angry
2018,blame whole season natalie season would different turn back alliance piss bitter
3179,gundlach call round top doom gloom move
3177,yeah im home againnstill feel mix inside amp kinda gloomy little optimistic ill figure
3323,marcos rojo play man unite let sink
233,hearty welcome follow
825,lose blinders panic
1055,zika hoax file deet part binary chemical weapon target brain toxin fear neurological uscitizens insect mammal
137,happy bright identity timelesstips friendship family forest water family truelove god roadsofar lifetrip
476,cheerful sloth annotate old book good man gods end evil
2138,track show equipment deliver wasnt service suddenly delay weve already weeks
1235,u shd b embrrssd u jack bp meds twice still take days express expressscripts horrible
3293,nahh thats grim
3208,post series depression quite bad get better bet someone pick novel soon west
1455,like start college horrific probably get better dont give yet
3200,yall tune snapchat bean funereal
2175,spur radio commentator refer mauricio pochettino mopo felt sudden surge rage
432,anyone know mariners today mood seem strangely jubilant meatloaf say aint bad unless win one
3139,shame world gloom day one almostthough make sense hed whole part hydrapart shieldc
3307,shin good deed weary world roald dahl charlie chocolate factory
555,watch amaze lively broadcast musically
1182,watch paranormal activity ghost dimension im sure feel yet
1007,someone wake make remix bw terrencecrutcher election colinkapernick terrorism riot much
2980,sadly sort poster die afaik
2412,hah dont speak cousin like mind displeasure see u bare face eh train pretty sight mate
2816,miss
1321,god need new goal keeper horrific
3202,goodbye despair
1454,finally start homefronttherevolution story gameplay terrible wasteofmoney
2587,terrible thing see visionnnhelen kellernnbegin end mindnnstephen coveynnwhereareugoing relentless
419,defo hearty root veg gratin nice comfort food autumn kick
1496,cant bully niall impossible
3539,serious intermediaries require info project owner mail
3004,ive return dead desire clean apartment eat something isnt garbage manage depression
2300,direct anger thieve governmentcorruption feesmustfall
683,listen oblivion score drink coffee research new scifi animate project
184,tfw youre enroute future im come ya openhouse futurecantor exhilarate nycletsgo
2340,never bring back meech bridgette cry someone look ugh bridgette bitter
3434,check work todaynncoffee drink serious business nnthursday bring friday
397,watch amaze lively broadcast musically
718,saw dream dash ampamp divide like million star night sky wish ampamp sparkle ampamp break
3304,well courseprogress sake progress must discourage problem substance rhetoric
212,neighbor dance clayton home commercial hilarious
2658,exactly say fb
1438,india want shake hand pakistan usual pakistan cheat every indian nnshameless pakistan
3062,frown cup cheek hand step aside angela care dont know else
205,sweet
2123,break record madden wish didnt say shit every rush like break record shutupphilsimms
1260,nawazsharif say let end terror sure let indianarmedforces target base without pakistan interference karma
1282,bully bullshit fullofshit please take garbage
1220,thats fuck horrific defend schalke
2532,life tip know unresolved anger likely cause problems several areas life must recognize amp properly deal
1870,wasnt joke
1315,dread pitt
886,get hand im freak deathand im god mommagrendel intimidation
1500,furries restless tonight
1386,get call shy mean consideredturn negative positives quote marniemccormack womenintech
887,saga devices teles fail time bake panic gbbo
1493,plus point wont queue loos plus point nope cant think sexism
2719,im u b mind business grind relentless
267,happy next class cancel bcim od tire
389,start watch glee week addict gleek
1075,say word radical islamic terrorist somehow make terror group drop weapons
2554,see ripshawtylo get think bout rappers think die burst tear smh
3469,pax enjoy gloom
873,today horrible half day
2543,blame break madden year
1232,unfortunately diet still wait till friday im afraid
567,bring back heyday nominatebunkface
305,promise restoration nation israeleverywhere look bless barnswine overfloweverything beautiful dousee
651,least hes will discuss better keep insult light occasional levity creative bsing
2106,rage crookedcourt say rage many time explain away brutal kill petits hay amp komisarjevsky
2655,anyway find short scale today perfect purpose soft hand wont aggravate nowchronic tendonitis
1669,thank concern computer last name isnt misspell weird
179,aint watch sugarboy hulu aint shit hilarious hahaha
2551,theyre still use offense middle x amp punt
612,provide dignify professional funerals price families afford satisfy clients bright pig
175,something v satisfy open old dodoc file able check things do smile
1244,india afraid bad
25,happy birthday bless day love toronto bday
1623,texans play horrible bad play call bad protection ball bad coach bad defense bad overall performance texans
3455,leave protect long theyve lose reason power
837,job interview afternoon nervous ek
1905,like commercial chocolate milk bender steal soccer ball guy refuse give back
3456,new job train much meat eat oh well also get approve drive lyft need car day sober
3129,cant alcohol sadly flare specific circumstances need careful
3088,people protest adrenaline rush depress
165,joyous first webiversaryweb mitzvah smithsonians
2969,underground waterloo nice place thursday somanypeople grim
1419,rhobh want assume affair marry criticize awful
566,tom phillips jovial start weeks show joe strut video package quite juxtaposition
1285,blame benghazi youtube video blame email colinpowell blame terrorism weakhillary
1804,say get reelect
1273,ugh want punch wall every time use literally worst product ever make windows awful killme
2699,yesssapparently youve popular snap
1717,side fear lie freedom jb glossinger quote
2129,hes stupid hate lol bitter
615,truck delight delight truck
1637,profile doesnt discourage september edt trump fail
2505,best revenge move get continue succeed never give someone satisfaction watch suffer
2674,oh gosh get rag comment cruise fan die laugh
2888,prayers family friends amp members mourn loss engineer ryan osler lodd rip
213,please night lane next round amp bring liverpool anfield coys
2019,people irritate mf soul
2647,turn frown upside buddy
2593,well archie offense hes kinda old
3039,cant stop finish deject luckily one bathroom go stall wait pant dry
1424,research determine laughter actually anxiety
1272,approach terrorism antiracism pov futile instead promote prejudice towards racism way battlefield
3303,nls top bureaucrat director group form oppose nls top megaproject nlpoli never dull
63,ah get work much rejoice lol thank get taht
1118,country divide approach could fight terrorism pakistani terrorism martyrsnotbeggars
395,charlotte friend climb top windmill think view easy breezy beautiful
3407,corbyn lose walk cry corbyn supporter whispernndont mourn organisennand laugh laugh
3223,literally guy somewouldsaysuccessful guy tell ship sail kay guy first youre work sub last sink
158,yo v overtime hockey get sweaty damn ish exhilarate
310,im cheer nhlnycsweepstakes
2693,keep mind weak dont insult people theyre human
2739,huh sprint coach slowest team comp talk rob live
1941,start post photos
1258,data steal tell us shock
2866,jesus make think vols v fl game ive see ive never see win depression
2989,quite simply worst airline worstairline ive ever use shock appauling dire dismal beyondajoke useless
2638,hell fury like woman scorn william congreve
530,im back elate record fuck shit studio even
758,truly believe heart right satan rejoice one another
2091,someone let snake house bet kill bugger get hand huckfp
1505,make bully sit room let look debo day
1692,get terrible download speed fifa smh
3079,im kind confuse one thing right great future hand new thing lose needhelp
584,chew smile arcdental turlock
2843,cant even grieve one black body another one pop due pig brutality
2960,sulk peace
1020,awe feel bad naive ou worst
1164,realistic probability clown might next president clown uspol
2114,put much artefact point fury cant raid literally waste month life thank blizzard
2005,unbelievable take minutes get theres fault call hang fume treatcustomersfairly
1063,want slide dms im fuck shy shy
159,exhilarate last minute overtime wch
2431,ummm blog say simon stehr fake thill expect investigation forthwith
791,meet new people grow reality people desgusting fake lose cheerfulness start
487,check film robocoq animate shortfilms
1269,new play tonight pretty much blind run play game maybe get level rage horror
1676,talksport sound like broadcast someones basement quality amateurs
1801,induction day tomorrow pizza express
3086,give blue guitar couldnt stand main character sort skimread end get grim unsettle
222,cheer cheer red white grand final win fight thank
1375,monday face would punch monday horrible face punch fight joke like firstworldproblems need coffee asap follow
824,get nervous even think talk wanna die
418,felt bite shit get high blood sugar remember first one week incredible
1968,awe thank much love
353,watch amaze lively broadcast musically
2560,fan insult
3392,air radio film lot fan pond wales lose
3444,season penny dreadful netflixwell afternoon fill
2742,live order complete amaze life journey successfully
972,pakistan biggest victim terrorism nawaz sharif nreally biggest creator terrorism unga
174,sylvia elate receive kiss little prince bright smile clear glance garrett elyse
1396,hate black lady paint white internet laugh like terrible badform didntlaugh
2926,tomorrow last episode despair arc much shit gonna happen im emotionally prepare
2540,control anger sign righteous people promise paradise quran surah al imran verse reward gooddeed
2738,level half much better offense expect second half
3232,bare videos online anyone get rehabilitate anyone actually get help affliction jut get twitter videos
2468,skip meals national way show disappointment anger wiz
1502,also help majority nfl coach inept bill obriens play call wow awful gopats
3570,difference someones selfies theyre happy vs unhappy absolutely amaze
3288,fogo max pessimism bottom yet solid pe ratio restaurant let catch level level come
2426,get work theres fire drill fire burn outthere inthedark
2642,loled privilege exasperation bottle sell
3475,may alwayshungry havent sink low yet
986,dont wanna really go cant say deffo fear miss
751,hey would nice click pause pause window inactive animate gifs macos message app
1810,thank brotein shake
2670,gotta fast n furious
2137,unarm black kill white cop many die every month chicago wheres outrage
2034,boycott till butter pecan come back furious
1121,worry typos email simon draft attach
1107,discipleship train detox something messy cutoff choosefreedom cryout
269,mean
2662,sorry burst bubble isnt century anymore welcome st century
775,need bite gbbo cheer terrible day
2922,lose im fade
2573,whats kalis kitten ask frown curl fair skin forehead show scar cat
508,maketh barren woman keep house amp joyful mother childrennpraise ye lordnpsa
2204,bloody park ticket
1800,dont let fear hold back want use power push towards goals fear action
365,enliven soul
2189,unbelievable take minutes get theres fault call hang treatcustomersfairly
2950,click cupcake vehicles available sadness
1477,still wait see make appearance next week two months today order badservice
3204,name change uncle remus lewis foh theydontlikeyoueither lose unwoke
906,get hand im freak deathand im god mommagrendel
328,happy look couple
1863,ka like start cake like say c make sense
1955,make great taste shake word describe herbalifenutrition tastesogood nowords
1171,give hear please tell anything want listen maybe youre dont afraid anymore
443,something make excite terrify thrill nervous elate amp like youve kick gut need word
1150,overtime teamna wch nervous
1127,go thru thing yesterday panic betterday
2478,matt psychological study provocation abusive relationships
3151,maybe itd different stay sixth form still oppressive architecture uninteresting people
2990,hate know get half gym morning depress
2295,little nose irritation little chill body im flu flu flu fallsongs
582,cover smile maybe itll get better
3467,welcome dark honey
1012,bad news fam life still hard awful depression atleastihavebuffy
2432,baskets better im bad mood someone irritate practice please
2226,head home cut grass heat wanna go eat somewhere air condition pout adultingistheworst
745,early morning cheerfulness extremely obnoxious aldubndweeksary
2151,get fever highsni get boil blood
2472,people angry toward veggie burgers n wtf
452,zeth voice hit target n hold upside cheer towel
1189,angelinos horrific
975,aleppo city burn head terrorism assad regime amp russia bombard city right whitephosphrus bomb
865,make cry shake point parent calm give calm tablets
1044,think humans sense recognize impend doom
1420,zika hoax file deet part binary chemical weapon target brain toxin neurological uscitizens insect mammal
3466,never let see frown
2316,recommend read prisoners hate aaron beck anger
1645,fosumensa nightmare minutes difference premier league reserve league still wide
2956,story life lose
24,wonderful experience watch yesterday thankyou laughter
716,cheer punkin
1388,imagine person spray tan shudder
2172,jealous cry baby bitter gladsheisgone crybaby
435,quotesoup happy everything good see good side everything
1341,hope instinct reason human mind could kill animal never know despair
1423,anytime get near mic someone need smack w bat awful marblesinmouth
1822,watch cobblers load season gorre pro footballler terrible
1072,look massiah youngleadernpakistan massiah terrorism
2378,bloody right fume
1539,u get b kid anu firm respond send contact detail customerexperience
1949,angelic comrades flutter
1465,go make wanna start new shit today
194,like talk someone make laugh laughter best medicine
547,passenger car next u cheerfully ask cigarette directions
1572,big miss phantom dread syndrome dudes sick
1826,chuckle shake head noi really vivid imagination guess happen meet someonegt
3393,serious chink india armournproteinnmalnutritionnfeedingindianskillingindiancognitive deficitn
412,dont shy next time cheery bunch nnsam x
3349,vas ir al de amaity affliction
1738,wee cunts play chappy street get shoe chase scare fuck
1844,could pop round
1230,threaten kill kapernick kneel say every athlete stop play social justice equality come forth
1358,still salty fire alarm morning
181,im due big change ive pray think deserve positivity optimism
2419,hey folks sorry anything offensive get post yesterday account get hack fix though hope angry annoy
